{
  "$schema": "https://vomaste.cz/schemas/canonical/gap.schema.json",
  "schemaVersion": 1,
  "@context": "https://vomaste.cz/context/v1.jsonld",
  "@id": "https://vomaste.cz/id/dossiers/ales-juchelka/gaps/GAP-01",
  "@type": "vomaste:Gap",
  "recordType": "gap",
  "identifier": "GAP-01",
  "dossier": {
    "@id": "https://vomaste.cz/id/dossiers/ales-juchelka"
  },
  "title": "GAP-01 — Zda kauzu řeší jakýkoli kontrolní nebo trestní orgán — zodpovězeno",
  "description": "Ano, oběma směry: NKÚ vede od července 2026 správní kontrolu MPSV a hnutí STAN 23. 7. 2026 podalo trestní oznámení; ministerstvo samo oznámení nepodalo.",
  "priority": "nízká",
  "checked": "2026-08-03",
  "claims": [
    {
      "@id": "https://vomaste.cz/id/dossiers/ales-juchelka/claims/CLM-13"
    },
    {
      "@id": "https://vomaste.cz/id/dossiers/ales-juchelka/claims/CLM-14"
    },
    {
      "@id": "https://vomaste.cz/id/dossiers/ales-juchelka/claims/CLM-15"
    },
    {
      "@id": "https://vomaste.cz/id/dossiers/ales-juchelka/claims/CLM-40"
    },
    {
      "@id": "https://vomaste.cz/id/dossiers/ales-juchelka/claims/CLM-42"
    }
  ],
  "subjects": [
    "juchelka"
  ],
  "content": [
    {
      "type": "markdown",
      "value": "Zda kauzu řeší jakýkoli kontrolní nebo trestní orgán — zodpovězeno\n\n**Původní mezera** (30. 7. 2026): tehdy citovaný zdroj ([SRC-02](@/dossiers/ales-juchelka/sources/src-02.md)) popisoval střet zájmů a jeho rozpočtový následek, ale neuváděl žádné vyšetřování, trestní oznámení ani obvinění.\n\n**Odpověď (ověřeno 3. 8. 2026 proti aktuálnímu zpravodajství, žádný novější vývoj nenalezen nad rámec už citovaného)**: dossier mezitím doplnil tvrzení, která otázku zodpovídají oběma směry —\n\n- **Kontrolní rovina**: Nejvyšší kontrolní úřad zahrnul působení bývalé poradkyně do své (správní, nikoli trestní) kontroly MPSV, zahájené v červenci 2026 s předpokládaným dokončením v polovině roku 2027 ([CLM-14](@/dossiers/ales-juchelka/claims/clm-14.md)); v jejím rámci se ministerstva mimo jiné ptal, zda samo zvažuje podat trestní oznámení ([CLM-42](@/dossiers/ales-juchelka/claims/clm-42.md)).\n- **Trestní rovina**: opoziční hnutí STAN 23. 7. 2026 podalo trestní oznámení kvůli možnému střetu zájmů při vyplácení unijních peněz z NPO ([CLM-13](@/dossiers/ales-juchelka/claims/clm-13.md), [CLM-40](@/dossiers/ales-juchelka/claims/clm-40.md)). Jde o podaný podnět k prověření, nikoli o zahájené trestní stíhání — nikdo nebyl obviněn ani odsouzen.\n- Samotné ministerstvo práce k 29. 7. 2026 žádné trestní oznámení nepodalo ([CLM-15](@/dossiers/ales-juchelka/claims/clm-15.md)).\n\nTato mezera je tímto zodpovězena a uzavřena. Zda a jak orgány činné v trestním řízení na oznámení STAN zareagují a jaké budou závěry kontroly NKÚ, není k datu ověření známo — případný budoucí vývoj patří do nové, samostatné mezery, ne do dodatečného rozšiřování této."
    }
  ],
  "order": 1
}
