{
  "$schema": "https://vomaste.cz/schemas/canonical/gap.schema.json",
  "schemaVersion": 1,
  "@context": "https://vomaste.cz/context/v1.jsonld",
  "@id": "https://vomaste.cz/id/dossiers/boris-stastny/gaps/GAP-06",
  "@type": "vomaste:Gap",
  "recordType": "gap",
  "identifier": "GAP-06",
  "dossier": {
    "@id": "https://vomaste.cz/id/dossiers/boris-stastny"
  },
  "title": "GAP-06 — Zda se kauzou nahrávacího zařízení zabýval bezpečnostní výbor Poslanecké sněmovny nebo zda",
  "description": "V dostupných zdrojích se objevují pouze mediální a stranické reakce, nikoli formální parlamentní kroky.",
  "priority": "střední",
  "checked": "2026-07-30",
  "claims": [],
  "subjects": [
    "stastny"
  ],
  "content": [
    {
      "type": "markdown",
      "value": "Zda se kauzou nahrávacího zařízení zabýval bezpečnostní výbor Poslanecké sněmovny nebo zda byla podána interpelace.\n\n**Proč je to mezera**: V dostupných zdrojích se objevují pouze mediální a stranické reakce, nikoli formální parlamentní kroky. Tato mezera **není** zjištěním žádným\nsměrem — zaznamenává jen, co se k datu kontroly nepodařilo doložit\notevřeným zdrojem."
    }
  ],
  "order": 6
}
