{
  "$schema": "https://vomaste.cz/schemas/canonical/gap.schema.json",
  "schemaVersion": 1,
  "@context": "https://vomaste.cz/context/v1.jsonld",
  "@id": "https://vomaste.cz/id/dossiers/martin-sebestyan/gaps/GAP-12",
  "@type": "vomaste:Gap",
  "recordType": "gap",
  "identifier": "GAP-12",
  "dossier": {
    "@id": "https://vomaste.cz/id/dossiers/martin-sebestyan"
  },
  "title": "GAP-12 — Nepodařilo se ověřit rozhovor s generálním ředitelem SZIF Petrem Dlouhým, v němž podle tit",
  "description": "Článek Hospodářských novin je za paywallem.",
  "priority": "střední",
  "checked": "2026-07-30",
  "claims": [],
  "subjects": [
    "sebestyan"
  ],
  "content": [
    {
      "type": "markdown",
      "value": "Nepodařilo se ověřit rozhovor s generálním ředitelem SZIF Petrem Dlouhým, v němž podle titulku uvedl, že fond neměl argumenty k úspěchu u soudu.\n\n**Proč je to mezera**: Článek Hospodářských novin je za paywallem. Tato mezera **není** zjištěním žádným\nsměrem — zaznamenává jen, co se k datu kontroly nepodařilo doložit\notevřeným zdrojem."
    }
  ],
  "order": 12
}
