{
  "$schema": "https://vomaste.cz/schemas/canonical/gap.schema.json",
  "schemaVersion": 1,
  "@context": "https://vomaste.cz/context/v1.jsonld",
  "@id": "https://vomaste.cz/id/dossiers/jeronym-tejc/gaps/GAP-06",
  "@type": "vomaste:Gap",
  "recordType": "gap",
  "identifier": "GAP-06",
  "dossier": {
    "@id": "https://vomaste.cz/id/dossiers/jeronym-tejc"
  },
  "title": "GAP-06 — Není doložen výsledek kontroly postupů OSPOD ve Středočeském kraji a v Praze ani závěry Ko",
  "description": "Dostupné zdroje potvrzují pouze podání podnětu a první zasedání komise; dětský ombudsman výslovně uvedl, že závěry ještě nejsou hotové.",
  "priority": "střední",
  "checked": "2026-08-03",
  "claims": [],
  "subjects": [
    "tejc"
  ],
  "content": [
    {
      "type": "markdown",
      "value": "Není doložen výsledek kontroly postupů OSPOD ve Středočeském kraji a v Praze ani závěry Komise pro přezkum nepřirozených úmrtí dětí.\n\n**Proč je to mezera**: Dostupné zdroje potvrzují pouze podání podnětu a první zasedání komise; dětský ombudsman výslovně uvedl, že závěry ještě nejsou hotové. Tato mezera **není** zjištěním žádným\nsměrem — zaznamenává jen, co se k datu kontroly nepodařilo doložit\notevřeným zdrojem.\n\n**Opakovaná kontrola k 2026-08-03**: cílené hledání zopakováno, žádné nové závěry komise ani kontroly OSPOD nedohledány. Mezera zůstává otevřená."
    }
  ],
  "order": 6
}
