{
  "$schema": "https://vomaste.cz/schemas/canonical/gap.schema.json",
  "schemaVersion": 1,
  "@context": "https://vomaste.cz/context/v1.jsonld",
  "@id": "https://vomaste.cz/id/dossiers/boris-stastny/gaps/GAP-10",
  "@type": "vomaste:Gap",
  "recordType": "gap",
  "identifier": "GAP-10",
  "dossier": {
    "@id": "https://vomaste.cz/id/dossiers/boris-stastny"
  },
  "title": "GAP-10 — Kdo konkrétně grafiku s upravenými metrikami vytvořil a schválil.",
  "description": "Ministr podle Tiscali konkrétního autora ani interní schvalovací proces nespecifikoval.",
  "priority": "střední",
  "checked": "2026-07-30",
  "claims": [],
  "subjects": [
    "stastny"
  ],
  "content": [
    {
      "type": "markdown",
      "value": "Kdo konkrétně grafiku s upravenými metrikami vytvořil a schválil.\n\n**Proč je to mezera**: Ministr podle Tiscali konkrétního autora ani interní schvalovací proces nespecifikoval. Tato mezera **není** zjištěním žádným\nsměrem — zaznamenává jen, co se k datu kontroly nepodařilo doložit\notevřeným zdrojem."
    }
  ],
  "order": 10
}
